### ISSUE TITLE
Hard-coded whois_query_irrd() timeout is not sufficient for some authoritative NRTM mirrors

### ISSUE THREAD

**Issue by GD1200** [irrdnet/irrd#1018]
**Describe the bug**
It was noticed that NRTM synchronisation is often fails silently (even with `log.level: WARNING`) due to a short hard-coded `whois_query_irrd()` timeout of 5 seconds:

https://github.com/irrdnet/irrd/blob/v4.4.4/irrd/utils/whois_client.py#L27

For example, such behaviour has been observed for APNIC's official NRTM service.

**To Reproduce**
To reproduce the issue, the local mirror must first be registered with APNIC.

The output below shows that it it takes around 15 seconds for the remote server to start sending 70k serials produced in one day:

```
$ time echo '-g APNIC:3:14722462-LAST' | nc nrtm.apnic.net 43003 | grep -m1 START
%START Version: 3 APNIC 14722462-14792475

real	0m15.747s
user	0m0.006s
sys	0m0.027s
```

The output below shows that the NRTM client (irrd) gives up after 5 seconds by terminating the established TCP session (FIN sent):

```
No.	Time	Source	Destination	Protocol	Length	ID	Info
1	2025-11-19 09:52:23.860519	<NRTM_CLIENT>	<NRTM_SERVER>	TCP	74		44492 → 43003 [SYN] Seq=0 Win=64240 Len=0 MSS=1460 SACK_PERM TSval=3459576838 TSecr=0 WS=128
2	2025-11-19 09:52:24.133080	<NRTM_SERVER>	<NRTM_CLIENT>	TCP	74		43003 → 44492 [SYN, ACK] Seq=0 Ack=1 Win=14180 Len=0 MSS=1430 SACK_PERM TSval=854268103 TSecr=3459576838 WS=512
3	2025-11-19 09:52:24.133144	<NRTM_CLIENT>	<NRTM_SERVER>	TCP	66		44492 → 43003 [ACK] Seq=1 Ack=1 Win=64256 Len=0 TSval=3459577111 TSecr=854268103
4	2025-11-19 09:52:24.133374	<NRTM_CLIENT>	<NRTM_SERVER>	TCP	91		44492 → 43003 [PSH, ACK] Seq=1 Ack=1 Win=64256 Len=25 TSval=3459577111 TSecr=854268103
5	2025-11-19 09:52:24.406043	<NRTM_SERVER>	<NRTM_CLIENT>	TCP	66		43003 → 44492 [ACK] Seq=1 Ack=26 Win=14336 Len=0 TSval=854268376 TSecr=3459577111

<5-sec timeout>

6	2025-11-19 09:52:29.138956	<NRTM_CLIENT>	<NRTM_SERVER>	TCP	66		44492 → 43003 [FIN, ACK] Seq=26 Ack=1 Win=64256 Len=0 TSval=3459582116 TSecr=854268376
7	2025-11-19 09:52:29.412369	<NRTM_SERVER>	<NRTM_CLIENT>	TCP	66		43003 → 44492 [FIN, ACK] Seq=1 Ack=27 Win=14336 Len=0 TSval=854273383 TSecr=3459582116
8	2025-11-19 09:52:29.412411	<NRTM_CLIENT>	<NRTM_SERVER>	TCP	66		44492 → 43003 [ACK] Seq=27 Ack=2 Win=64256 Len=0 TSval=3459582390 TSecr=854273383
```

As a result, when bulk serial updates happen on slow or busy mirror servers, 5-seconds interval is not sufficient to synchronise them. When it happens, the source gets locked until the full import is performed.

**Expected behaviour**
- Timeout errors should be logged as lack of them significantly complicates troubleshooting.
- Ideally, the timeout should be configurable per source as the mirror server performance variates from source to source.

**IRRd version you are running**
4.4.4

**Comment by damienallen** [comment]
Seems as though we're also bumping into this issue with both v4.4.4 and v4.5.0-beta2 instances.

Sources in question are most often ARIN and RADB which can have many serial updates per day. Following NRTM desync events we have resorted to running `irrd_mirror_force_reload` manually when our alert triggers.

How do the maintainer(s) feel about the expected behavior proposed by @GD1200? Open to a PR along those lines?

**Comment by mxsasha** [comment]
> How do the maintainer(s) feel about the expected behavior proposed by [@GD1200](https://github.com/GD1200)? Open to a PR along those lines?

Yes, this sounds like a good fix. Feel free to open a PR.

**Comment by damienallen** [comment]
> Yes, this sounds like a good fix. Feel free to open a PR.

Okay, I gave it shot!
